{
  "$schema": "https://json-schema.org/draft/2020-12/schema",
  "$id": "https://schemas.ecp-protocol.org/0.7.0/registration-gate-state.schema.json",
  "title": "ECP Registration Gate State (M3-RG0 authoritative trust instrument)",
  "description": "The AUTHORITATIVE registration-gate document of a protected evaluation + registration trust store (M3-RG0, 0.7.0, order §10 / ADJ-06 hard precondition). It lives in the authoritative zone (authoritative/gate.json) and states, machine-checkably: registration OPEN/CLOSED, model execution OPEN/CLOSED, scientific results NONE/PRESENT, and the six Owner-bound operational citations (O-01/O-02/O-04/F-01a/F-01b/POP) in force — null while unresolved, frozen to the owner-gate-order values once an order opens the gate. The ONLY legal mutation path is apply_owner_gate_order (an explicit owner instrument recorded as a lineage gate-transition event); there is no other writer. gate_hash = SHA-256 over the ECP-CANONICAL-JSON-1.0 serialization of this document with gate_hash removed (the established self-referential exclusion rule; never hash the populated field). Real gate material lives only in a private trust area; public illustrations under examples/ must be format-illustration records with real recomputable hashes.",
  "type": "object",
  "required": [
    "ecp_object",
    "gate_id",
    "trust_store_id",
    "scope",
    "registration_gate",
    "model_execution_gate",
    "scientific_results",
    "basis",
    "transition_rule",
    "owner_ruling_citations",
    "recorded_at",
    "protocol_version",
    "schema_version",
    "gate_hash"
  ],
  "properties": {
    "ecp_object": { "const": "registration-gate-state" },
    "content_class": {
      "enum": ["review", "format-illustration"],
      "description": "'review' = real gate material (private trust area only); 'format-illustration' = public dummy (examples/ only)."
    },
    "gate_id": {
      "type": "string",
      "pattern": "^ECP-GATE-[A-Za-z0-9][A-Za-z0-9._:-]*$"
    },
    "trust_store_id": {
      "type": "string",
      "pattern": "^ECP-TRUST-[A-Za-z0-9][A-Za-z0-9._:-]*$"
    },
    "scope": {
      "enum": ["development", "operational"],
      "description": "A development-scope order can never govern an operational-scope trust store and vice versa (scope binding)."
    },
    "registration_gate": { "enum": ["CLOSED", "OPEN"] },
    "model_execution_gate": { "enum": ["CLOSED", "OPEN"] },
    "scientific_results": { "enum": ["NONE", "PRESENT"] },
    "basis": {
      "type": "array",
      "minItems": 1,
      "items": { "type": "string", "minLength": 1 }
    },
    "transition_rule": {
      "type": "string",
      "minLength": 1,
      "description": "Gate transitions ONLY via an explicit owner-gate-order instrument applied through the governed seam and recorded as a lineage gate-transition event; no other writer exists."
    },
    "owner_ruling_citations": {
      "type": "object",
      "required": ["O-01", "O-02", "O-04", "F-01a", "F-01b", "POP"],
      "additionalProperties": false,
      "properties": {
        "O-01": { "type": ["string", "null"], "description": "External novelty-evidence slot; null = unresolved (never inferred)." },
        "O-02": { "type": ["string", "null"], "description": "Registration-contract authorization slot; null = unresolved." },
        "O-04": { "type": ["string", "null"], "description": "Protected ground-truth ruling slot (six sub-fields); null = unresolved." },
        "F-01a": { "type": ["string", "null"], "description": "Set-level preregistration timing slot; null = unresolved." },
        "F-01b": { "type": ["string", "null"], "description": "Case ordering rule slot; null = unresolved." },
        "POP": { "type": ["string", "null"], "description": "Population decision slot; null = unresolved." }
      }
    },
    "gate_order_reference": {
      "type": "object",
      "required": ["order_id", "order_sha256", "applied_at"],
      "additionalProperties": false,
      "properties": {
        "order_id": {
          "type": "string",
          "pattern": "^ECP-GATEORDER-[A-Za-z0-9][A-Za-z0-9._:-]*$"
        },
        "order_sha256": { "$ref": "#/$defs/sha256_hex" },
        "applied_at": { "$ref": "#/$defs/iso8601_utc" }
      }
    },
    "recorded_at": { "$ref": "#/$defs/iso8601_utc" },
    "protocol_version": { "$ref": "#/$defs/semver" },
    "schema_version": { "$ref": "#/$defs/semver" },
    "gate_hash": { "$ref": "#/$defs/sha256_hex" }
  },
  "additionalProperties": false,
  "allOf": [
    {
      "if": { "properties": { "registration_gate": { "const": "OPEN" } } },
      "then": { "required": ["gate_order_reference"] }
    },
    {
      "if": { "properties": { "registration_gate": { "const": "OPEN" } } },
      "then": {
        "properties": {
          "owner_ruling_citations": {
            "properties": {
              "O-01": { "type": "string" },
              "O-02": { "type": "string" },
              "O-04": { "type": "string" },
              "F-01a": { "type": "string" },
              "F-01b": { "type": "string" },
              "POP": { "type": "string" }
            }
          }
        }
      }
    }
  ],
  "$defs": {
    "semver": {
      "type": "string",
      "pattern": "^(0|[1-9]\\d*)\\.(0|[1-9]\\d*)\\.(0|[1-9]\\d*)(?:-((?:0|[1-9]\\d*|\\d*[a-zA-Z-][0-9a-zA-Z-]*)(?:\\.(?:0|[1-9]\\d*|\\d*[a-zA-Z-][0-9a-zA-Z-]*))*))?(?:\\+([0-9a-zA-Z-]+(?:\\.[0-9a-zA-Z-]+)*))?$"
    },
    "sha256_hex": { "type": "string", "pattern": "^[0-9a-f]{64}$" },
    "iso8601_utc": {
      "type": "string",
      "pattern": "^\\d{4}-\\d{2}-\\d{2}T\\d{2}:\\d{2}:\\d{2}(\\.\\d+)?Z$"
    }
  }
}
